{"type":"object","properties":{"schema_version":{"const":"1.0.0"},"model_version":{"const":"mlr-1.0.0"},"split":{"const":"TEST"},"source":{"type":"object","properties":{"path":{"type":"string","pattern":"^(reports|artifacts|configs)/"},"sha256":{"type":"string","pattern":"^[a-f0-9]{64}$"}},"required":["path","sha256"],"additionalProperties":false},"aggregation":{"const":"source-local hourly; arithmetic means, actual maxima and exact counts"},"source_rows":{"const":2962},"rows":{"type":"array","maxItems":500,"items":{"type":"object","properties":{"timestamp":{"type":"string","pattern":"^\\d{4}-\\d{2}-\\d{2} \\d{2}:\\d{2}:\\d{2}$"},"count":{"type":"integer","minimum":1},"actual_mean":{"type":"number"},"actual_max":{"type":"number"},"prediction_mean":{"type":"number"},"lower_mean":{"type":"number"},"upper_mean":{"type":"number"},"covered_count":{"type":"integer","minimum":0}},"required":["timestamp","count","actual_mean","actual_max","prediction_mean","lower_mean","upper_mean","covered_count"],"additionalProperties":false}}},"required":["schema_version","model_version","split","source","aggregation","source_rows","rows"],"additionalProperties":false,"$schema":"https://json-schema.org/draft/2020-12/schema","$id":"urn:smart-home-energy:test-series:1.0.0"}