{"schema_version":"1.0.0","model_version":"mlr-1.0.0","split":"TEST","source":{"path":"reports/evaluation/c2-mlr-1.0.0/predictions.csv","sha256":"a7cc7c0f62b48a19ee4ceb5300b6d0eced850e439be4b82d9e6d31c710df3471"},"aggregation":"source-local hourly; arithmetic means, actual maxima and exact counts","source_rows":2962,"rows":[{"count":3,"actual_mean":60.0,"actual_max":60,"prediction_mean":62.78892671745365,"lower_mean":0.0,"upper_mean":248.14604815365306,"covered_count":3,"timestamp":"2016-05-07 04:00:00"},{"count":6,"actual_mean":51.666666666666664,"actual_max":60,"prediction_mean":71.70652230271789,"lower_mean":0.0,"upper_mean":257.0636437389173,"covered_count":6,"timestamp":"2016-05-07 05:00:00"},{"count":6,"actual_mean":53.333333333333336,"actual_max":60,"prediction_mean":76.57757677789675,"lower_mean":0.0,"upper_mean":261.93469821409616,"covered_count":6,"timestamp":"2016-05-07 06:00:00"},{"count":6,"actual_mean":148.33333333333334,"actual_max":360,"prediction_mean":76.846766638917,"lower_mean":0.0,"upper_mean":262.2038880751164,"covered_count":5,"timestamp":"2016-05-07 07:00:00"},{"count":6,"actual_mean":121.66666666666667,"actual_max":200,"prediction_mean":86.53546910924865,"lower_mean":0.0,"upper_mean":271.89259054544806,"covered_count":6,"timestamp":"2016-05-07 08:00:00"},{"count":6,"actual_mean":153.33333333333334,"actual_max":240,"prediction_mean":78.32669437588386,"lower_mean":0.0,"upper_mean":263.6838158120833,"covered_count":6,"timestamp":"2016-05-07 09:00:00"},{"count":6,"actual_mean":178.33333333333334,"actual_max":360,"prediction_mean":88.48162225357301,"lower_mean":0.0,"upper_mean":273.8387436897724,"covered_count":5,"timestamp":"2016-05-07 10:00:00"},{"count":6,"actual_mean":161.66666666666666,"actual_max":260,"prediction_mean":74.26564339327986,"lower_mean":0.0,"upper_mean":259.62276482947925,"covered_count":5,"timestamp":"2016-05-07 11:00:00"},{"count":6,"actual_mean":86.66666666666667,"actual_max":100,"prediction_mean":75.93201339376378,"lower_mean":0.0,"upper_mean":261.2891348299632,"covered_count":6,"timestamp":"2016-05-07 12:00:00"},{"count":6,"actual_mean":75.0,"actual_max":80,"prediction_mean":91.07658612513688,"lower_mean":0.0,"upper_mean":276.4337075613363,"covered_count":6,"timestamp":"2016-05-07 13:00:00"},{"count":6,"actual_mean":88.33333333333333,"actual_max":100,"prediction_mean":96.84152600175031,"lower_mean":0.0,"upper_mean":282.1986474379497,"covered_count":6,"timestamp":"2016-05-07 14:00:00"},{"count":6,"actual_mean":103.33333333333333,"actual_max":110,"prediction_mean":86.88313239374213,"lower_mean":0.0,"upper_mean":272.24025382994154,"covered_count":6,"timestamp":"2016-05-07 15:00:00"},{"count":6,"actual_mean":91.66666666666667,"actual_max":100,"prediction_mean":90.3735948743713,"lower_mean":0.0,"upper_mean":275.7307163105707,"covered_count":6,"timestamp":"2016-05-07 16:00:00"},{"count":6,"actual_mean":83.33333333333333,"actual_max":90,"prediction_mean":97.00148280916919,"lower_mean":0.0,"upper_mean":282.35860424536855,"covered_count":6,"timestamp":"2016-05-07 17:00:00"},{"count":6,"actual_mean":285.0,"actual_max":630,"prediction_mean":106.16643601925476,"lower_mean":0.0,"upper_mean":291.5235574554542,"covered_count":4,"timestamp":"2016-05-07 18:00:00"},{"count":6,"actual_mean":120.0,"actual_max":140,"prediction_mean":103.49195550670635,"lower_mean":0.0,"upper_mean":288.84907694290575,"covered_count":6,"timestamp":"2016-05-07 19:00:00"},{"count":6,"actual_mean":86.66666666666667,"actual_max":100,"prediction_mean":102.5404618148329,"lower_mean":0.0,"upper_mean":287.8975832510323,"covered_count":6,"timestamp":"2016-05-07 20:00:00"},{"count":6,"actual_mean":56.666666666666664,"actual_max":60,"prediction_mean":96.55276706874685,"lower_mean":0.0,"upper_mean":281.90988850494625,"covered_count":6,"timestamp":"2016-05-07 21:00:00"},{"count":6,"actual_mean":58.333333333333336,"actual_max":70,"prediction_mean":93.0364401508486,"lower_mean":0.0,"upper_mean":278.39356158704805,"covered_count":6,"timestamp":"2016-05-07 22:00:00"},{"count":6,"actual_mean":56.666666666666664,"actual_max":60,"prediction_mean":91.47591806987718,"lower_mean":0.0,"upper_mean":276.8330395060766,"covered_count":6,"timestamp":"2016-05-07 23:00:00"},{"count":6,"actual_mean":58.333333333333336,"actual_max":60,"prediction_mean":58.95547149544177,"lower_mean":0.0,"upper_mean":244.3125929316412,"covered_count":6,"timestamp":"2016-05-08 00:00:00"},{"count":6,"actual_mean":51.666666666666664,"actual_max":60,"prediction_mean":62.622517643455886,"lower_mean":0.0,"upper_mean":247.97963907965527,"covered_count":6,"timestamp":"2016-05-08 01:00:00"},{"count":6,"actual_mean":55.0,"actual_max":60,"prediction_mean":65.98438229928742,"lower_mean":0.0,"upper_mean":251.34150373548684,"covered_count":6,"timestamp":"2016-05-08 02:00:00"},{"count":6,"actual_mean":56.666666666666664,"actual_max":60,"prediction_mean":68.3180044766171,"lower_mean":0.0,"upper_mean":253.6751259128165,"covered_count":6,"timestamp":"2016-05-08 03:00:00"},{"count":6,"actual_mean":50.0,"actual_max":60,"prediction_mean":63.63317981017982,"lower_mean":0.0,"upper_mean":248.9903012463792,"covered_count":6,"timestamp":"2016-05-08 04:00:00"},{"count":6,"actual_mean":56.666666666666664,"actual_max":60,"prediction_mean":64.0441177554494,"lower_mean":0.0,"upper_mean":249.40123919164884,"covered_count":6,"timestamp":"2016-05-08 05:00:00"},{"count":6,"actual_mean":50.0,"actual_max":60,"prediction_mean":69.89617090133629,"lower_mean":0.0,"upper_mean":255.25329233753567,"covered_count":6,"timestamp":"2016-05-08 06:00:00"},{"count":6,"actual_mean":60.0,"actual_max":90,"prediction_mean":70.96841539524102,"lower_mean":0.0,"upper_mean":256.32553683144044,"covered_count":6,"timestamp":"2016-05-08 07:00:00"},{"count":6,"actual_mean":183.33333333333334,"actual_max":400,"prediction_mean":85.05650781448615,"lower_mean":0.0,"upper_mean":270.4136292506856,"covered_count":4,"timestamp":"2016-05-08 08:00:00"},{"count":6,"actual_mean":143.33333333333334,"actual_max":330,"prediction_mean":79.38018731446724,"lower_mean":0.0,"upper_mean":264.7373087506666,"covered_count":5,"timestamp":"2016-05-08 09:00:00"},{"count":6,"actual_mean":135.0,"actual_max":410,"prediction_mean":86.90156303850192,"lower_mean":0.0,"upper_mean":272.25868447470134,"covered_count":5,"timestamp":"2016-05-08 10:00:00"},{"count":6,"actual_mean":50.0,"actual_max":60,"prediction_mean":101.00255769802531,"lower_mean":0.0,"upper_mean":286.35967913422473,"covered_count":6,"timestamp":"2016-05-08 11:00:00"},{"count":6,"actual_mean":56.666666666666664,"actual_max":60,"prediction_mean":108.69391835341996,"lower_mean":0.0,"upper_mean":294.0510397896194,"covered_count":6,"timestamp":"2016-05-08 12:00:00"},{"count":6,"actual_mean":56.666666666666664,"actual_max":60,"prediction_mean":116.16461751142879,"lower_mean":0.0,"upper_mean":301.5217389476282,"covered_count":6,"timestamp":"2016-05-08 13:00:00"},{"count":6,"actual_mean":56.666666666666664,"actual_max":60,"prediction_mean":124.76603042591894,"lower_mean":0.0,"upper_mean":310.1231518621184,"covered_count":6,"timestamp":"2016-05-08 14:00:00"},{"count":6,"actual_mean":50.0,"actual_max":60,"prediction_mean":128.54623950861705,"lower_mean":0.0,"upper_mean":313.9033609448164,"covered_count":6,"timestamp":"2016-05-08 15:00:00"},{"count":6,"actual_mean":55.0,"actual_max":60,"prediction_mean":132.53965378006828,"lower_mean":0.0,"upper_mean":317.8967752162677,"covered_count":6,"timestamp":"2016-05-08 16:00:00"},{"count":6,"actual_mean":56.666666666666664,"actual_max":70,"prediction_mean":134.93193296065942,"lower_mean":0.0,"upper_mean":320.28905439685883,"covered_count":6,"timestamp":"2016-05-08 17:00:00"},{"count":6,"actual_mean":50.0,"actual_max":60,"prediction_mean":138.7912543645016,"lower_mean":0.0,"upper_mean":324.14837580070105,"covered_count":6,"timestamp":"2016-05-08 18:00:00"},{"count":6,"actual_mean":60.0,"actual_max":90,"prediction_mean":127.97443413932007,"lower_mean":0.0,"upper_mean":313.3315555755195,"covered_count":6,"timestamp":"2016-05-08 19:00:00"},{"count":6,"actual_mean":78.33333333333333,"actual_max":90,"prediction_mean":115.07373592011925,"lower_mean":0.0,"upper_mean":300.43085735631865,"covered_count":6,"timestamp":"2016-05-08 20:00:00"},{"count":6,"actual_mean":63.333333333333336,"actual_max":80,"prediction_mean":104.50727059997486,"lower_mean":0.0,"upper_mean":289.86439203617425,"covered_count":6,"timestamp":"2016-05-08 21:00:00"},{"count":6,"actual_mean":58.333333333333336,"actual_max":60,"prediction_mean":106.84436419475054,"lower_mean":0.0,"upper_mean":292.20148563094995,"covered_count":6,"timestamp":"2016-05-08 22:00:00"},{"count":6,"actual_mean":53.333333333333336,"actual_max":60,"prediction_mean":104.765356241873,"lower_mean":0.0,"upper_mean":290.1224776780724,"covered_count":6,"timestamp":"2016-05-08 23:00:00"},{"count":6,"actual_mean":55.0,"actual_max":60,"prediction_mean":69.29944679375853,"lower_mean":0.0,"upper_mean":254.6565682299579,"covered_count":6,"timestamp":"2016-05-09 00:00:00"},{"count":6,"actual_mean":58.333333333333336,"actual_max":70,"prediction_mean":75.50060276034311,"lower_mean":0.0,"upper_mean":260.8577241965425,"covered_count":6,"timestamp":"2016-05-09 01:00:00"},{"count":6,"actual_mean":55.0,"actual_max":60,"prediction_mean":80.84086579792945,"lower_mean":0.0,"upper_mean":266.1979872341289,"covered_count":6,"timestamp":"2016-05-09 02:00:00"},{"count":6,"actual_mean":53.333333333333336,"actual_max":60,"prediction_mean":85.40377962428828,"lower_mean":0.0,"upper_mean":270.7609010604877,"covered_count":6,"timestamp":"2016-05-09 03:00:00"},{"count":6,"actual_mean":56.666666666666664,"actual_max":60,"prediction_mean":88.0933265183172,"lower_mean":0.0,"upper_mean":273.4504479545166,"covered_count":6,"timestamp":"2016-05-09 04:00:00"},{"count":6,"actual_mean":65.0,"actual_max":90,"prediction_mean":83.504019991943,"lower_mean":0.0,"upper_mean":268.8611414281424,"covered_count":6,"timestamp":"2016-05-09 05:00:00"},{"count":6,"actual_mean":